{
  "version": 1,
  "revision": 4,
  "status": "draft",
  "visibility": "author_only",
  "source_policy": "references_not_another_story_source",
  "origin": "authored",
  "metadata": {
    "addition": true,
    "kind": "new_setting",
    "note": "추가: 기존 원고·구성·출판 순서·설정을 한 화면에서 조회하는 편집 도구. 새로운 이야기 원본이나 출판 승인이 아니다.",
    "knowledge_policy": "author_reference_not_character_knowledge"
  },
  "title": "소설 제작실",
  "navigation": [
    {"id": "overview", "label": "작업 현황"},
    {"id": "reading", "label": "소설 읽기"},
    {"id": "outline", "label": "목차 · 장별 구성"},
    {"id": "graph", "label": "분기 · 그래프"},
    {"id": "order", "label": "출판 편집 순서"},
    {"id": "settings", "label": "인물 · 세계 설정"},
    {"id": "sources", "label": "원본 JSON · 작업 규칙"}
  ],
  "default_document": "chapter01-interactive.html",
  "notes": [
    "작가용 전편 스포일러다. 화면의 확인 버튼이나 숨김은 접근 제어가 아니다. 파일을 공유하면 전체 자료도 공유된다.",
    "읽기 전용 제작실이다. 화면의 탐색·검색·경로 선택은 집필 JSON을 수정하거나 Git에 저장하지 않는다.",
    "소설 읽기는 실제 집필한 본문만 표시한다. 전편 소단락 요약과 곁가지 선택 시범은 분기·그래프의 분기 미리보기로 분리한다. 원고 JSON·검증 경로·원문·구성 자료는 보존하며 상세 본문 완성과 혼동하지 않는다.",
    "출판 편집 순서는 제안 경로다. 미선택 이야기를 끼워 넣지 않으며 페이지와 최종 출판 승인은 미정이다.",
    "참조 사전의 창작·추론·음역 추가와 증언·확정 사실, 공개 시점·복선을 구분한다. 작가 설정을 등장인물의 현재 지식으로 취급하지 않는다.",
    "한 HTML 파일에 현재 자료를 묶은 생성 스냅샷이다. 실제 수정은 표시된 원본 JSON에서 하고 writing.py export로 갱신한다.",
    "기존 공개 /novel 독자 화면에는 이 제작실이나 인물 마스터를 포함하지 않는다. 게임 수정·빌드·외부 서비스가 필요 없다."
  ]
}
